{
  "schema_version": 1,
  "session_id": 42,
  "statistics": {
    "loss": "timed_out/completed",
    "stddev": "sample_standard_deviation",
    "jitter": "ewma_absolute_consecutive_delta_alpha_1_16"
  },
  "target": "測試.example-𠀀-🌐",
  "started_at_utc": "2026-08-12T01:02:03.004Z",
  "ended_at_utc": "2026-08-12T01:02:13.004Z",
  "duration_ms": 10000,
  "hops": [
    {
      "hop": 1,
      "host": "router.example",
      "ip": "192.0.2.1",
      "loss_percent": 25.0,
      "sent": 9007199254740991,
      "completed": 4,
      "received": 3,
      "timed_out": 1,
      "in_flight": 0,
      "local_errors": 2,
      "scheduler_skipped": 3,
      "cache_skipped": 4,
      "late_completions": 1,
      "post_destination_completions": 0,
      "scheduler_late_slots": 2,
      "scheduler_lateness_total_ms": 17,
      "scheduler_lateness_max_ms": 12,
      "last_outcome": "ttl_expired",
      "last_error_code": 11013,
      "best_ms": 1,
      "average_ms": 2.5,
      "worst_ms": 5,
      "last_ms": 3,
      "jitter_ms": 0.75,
      "recent_jitter_ms": 1.0,
      "stddev_ms": 2.0,
      "country": "台灣",
      "asn": "64500",
      "isp": "Example, Inc.",
      "metadata_source": "ipinfo.io",
      "metadata_failure_reason": "",
      "responders": [
        {
          "id": "0123456789abcdef",
          "hit_count": 3,
          "last_seen_sequence": 7,
          "host": "router.example",
          "ip": "192.0.2.1",
          "country": "台灣",
          "asn": "64500",
          "isp": "Example, Inc.",
          "metadata_source": "ipinfo.io",
          "metadata_failure_reason": ""
        },
        {
          "id": "fedcba9876543210",
          "hit_count": 1,
          "last_seen_sequence": 5,
          "host": "備援-🌐.example",
          "ip": "2001:db8::1",
          "country": "",
          "asn": "",
          "isp": "",
          "metadata_source": "",
          "metadata_failure_reason": "no metadata"
        }
      ]
    },
    {
      "hop": 2,
      "host": "主機沒有回應",
      "ip": "",
      "loss_percent": 100.0,
      "sent": 1,
      "completed": 1,
      "received": 0,
      "timed_out": 1,
      "in_flight": 0,
      "local_errors": 0,
      "scheduler_skipped": 0,
      "cache_skipped": 0,
      "late_completions": 0,
      "post_destination_completions": 0,
      "scheduler_late_slots": 0,
      "scheduler_lateness_total_ms": 0,
      "scheduler_lateness_max_ms": 0,
      "last_outcome": "timeout",
      "last_error_code": 11010,
      "best_ms": null,
      "average_ms": null,
      "worst_ms": null,
      "last_ms": null,
      "jitter_ms": null,
      "recent_jitter_ms": null,
      "stddev_ms": null,
      "country": "",
      "asn": "",
      "isp": "",
      "metadata_source": "",
      "metadata_failure_reason": "",
      "responders": []
    }
  ]
}
